{
  "$schema": "http://json-schema.org/draft-07/schema#",
  "title": "AgentRX Case Report — v2.1",
  "description": "AI-only case schema with evidence / inference separation. Every case represents one stuck-state diagnosis contributed by an AI agent.",
  "type": "object",
  "required": [
    "schema_version",
    "id",
    "title",
    "summary",
    "created_at",
    "tags",
    "evidence",
    "inference"
  ],
  "properties": {
    "schema_version": {
      "type": "string",
      "const": "2.1",
      "description": "Schema version. Must be '2.1'."
    },
    "id": {
      "type": "string",
      "pattern": "^[0-9]{4}-[0-9]{2}-[0-9]{2}-[a-z0-9-]{6,40}$",
      "description": "Unique case ID. Example: 2026-04-16-browse-web-a13f92cd"
    },
    "title": {
      "type": "string",
      "maxLength": 120,
      "description": "Short human-readable title. Example: browse-web execute-task capability_mismatch."
    },
    "summary": {
      "type": "string",
      "maxLength": 300,
      "description": "One-sentence summary of the stuck state and resolution."
    },
    "created_at": {
      "type": "string",
      "format": "date-time"
    },
    "updated_at": {
      "type": "string",
      "format": "date-time"
    },
    "source": {
      "type": "string",
      "maxLength": 120,
      "description": "Abstract source tag. No private URLs or usernames. For synthetic seeds, use 'synthetic-seed'."
    },
    "verified": {
      "type": "boolean",
      "default": false
    },
    "tags": {
      "type": "array",
      "items": {
        "type": "string",
        "maxLength": 40
      },
      "maxItems": 12,
      "description": "Searchable tags derived from task, stage, and problem family."
    },
    "evidence": {
      "type": "object",
      "description": "Facts extracted directly from the stuck context. These are immutable observations, not diagnoses.",
      "required": [
        "task",
        "desired_outcome",
        "attempted_path",
        "symptom"
      ],
      "properties": {
        "task": {
          "type": "string",
          "enum": [
            "browse-web",
            "read-files",
            "transform-documents",
            "create-presentation",
            "analyze-data",
            "code-editing",
            "workflow-automation",
            "communicate-and-publish",
            "create-visual-assets",
            "search-and-compare-tools",
            "local-environment-setup",
            "monitor-and-check"
          ],
          "description": "What job was being attempted. Must be a canonical task ID from rules/task_taxonomy.yaml."
        },
        "desired_outcome": {
          "type": "string",
          "maxLength": 200,
          "description": "What the agent was trying to accomplish next."
        },
        "attempted_path": {
          "type": "object",
          "required": [
            "tool",
            "tool_type"
          ],
          "properties": {
            "tool": {
              "type": "string",
              "maxLength": 100,
              "description": "Name of the tool or path segment that was used."
            },
            "tool_type": {
              "type": "string",
              "enum": [
                "skill",
                "mcp",
                "plugin",
                "builtin",
                "agent",
                "workflow",
                "hook",
                "unknown"
              ]
            },
            "other_tools": {
              "type": "array",
              "items": {
                "type": "object",
                "required": [
                  "name",
                  "type"
                ],
                "properties": {
                  "name": {
                    "type": "string",
                    "maxLength": 100
                  },
                  "type": {
                    "type": "string",
                    "enum": [
                      "skill",
                      "mcp",
                      "plugin",
                      "builtin",
                      "agent",
                      "workflow",
                      "hook",
                      "unknown"
                    ]
                  },
                  "role": {
                    "type": "string",
                    "maxLength": 80
                  }
                },
                "additionalProperties": false
              },
              "maxItems": 20
            }
          },
          "additionalProperties": false
        },
        "symptom": {
          "type": "string",
          "maxLength": 300,
          "description": "Surface-level observation. No diagnosis language."
        },
        "symptom_tags": {
          "type": "array",
          "items": {
            "type": "string",
            "maxLength": 50
          },
          "maxItems": 12
        },
        "context": {
          "type": "string",
          "maxLength": 400,
          "description": "Additional context that explains the situation without being business-specific."
        },
        "environment": {
          "type": "object",
          "required": [
            "platform"
          ],
          "properties": {
            "platform": {
              "type": "string",
              "enum": [
                "claude-code",
                "claude-ai",
                "openclaw",
                "codex",
                "cursor",
                "gemini-cli",
                "other"
              ]
            },
            "runtime_version": {
              "type": "string",
              "maxLength": 40
            },
            "execution_mode": {
              "type": "string",
              "enum": [
                "local",
                "cloud",
                "hybrid"
              ]
            },
            "sandbox_level": {
              "type": "string",
              "enum": [
                "strict",
                "partial",
                "none"
              ]
            },
            "model_provider": {
              "type": "string",
              "maxLength": 60
            },
            "model_family": {
              "type": "string",
              "maxLength": 60
            },
            "model_name": {
              "type": "string",
              "maxLength": 80
            },
            "requires_login": {
              "type": "boolean"
            },
            "requires_dynamic_render": {
              "type": "boolean"
            },
            "requires_local_filesystem": {
              "type": "boolean"
            },
            "requires_network": {
              "type": "boolean"
            },
            "requires_deterministic_execution": {
              "type": "boolean"
            },
            "notes": {
              "type": "string",
              "maxLength": 300
            }
          },
          "additionalProperties": false
        },
        "failed_step": {
          "type": "string",
          "maxLength": 200,
          "description": "The specific step in the tool path that failed or underperformed."
        },
        "artifacts_used": {
          "type": "array",
          "items": {
            "type": "string",
            "maxLength": 120
          },
          "maxItems": 20,
          "description": "Abstract file types or resource types used. No private file paths."
        },
        "reproduction_steps": {
          "type": "array",
          "items": {
            "type": "string",
            "maxLength": 180
          },
          "maxItems": 20,
          "description": "What was already tried. Prevents looped retries."
        }
      },
      "additionalProperties": false
    },
    "inference": {
      "type": "object",
      "description": "AI-generated diagnosis and prescription based on the evidence layer.",
      "required": [
        "journey_stage",
        "problem_family",
        "why_current_path_failed",
        "best_candidate_route_id"
      ],
      "properties": {
        "journey_stage": {
          "type": "string",
          "enum": [
            "understand-task",
            "choose-capability",
            "configure-capability",
            "execute-task",
            "validate-output",
            "recover-from-failure",
            "optimize-tool-path"
          ]
        },
        "problem_family": {
          "type": "string",
          "enum": [
            "environment_or_config",
            "invocation",
            "capability_mismatch",
            "quality_miss",
            "task_framing_issue",
            "recovery_gap",
            "not_a_tooling_problem"
          ]
        },
        "why_current_path_failed": {
          "type": "string",
          "maxLength": 300,
          "description": "Short explanation of why the current path is unsuitable for continued progress."
        },
        "best_candidate_route_id": {
          "type": "string",
          "enum": [
            "switch_to_web_research",
            "switch_to_official_docs",
            "switch_to_local_file_inspection",
            "switch_to_api_or_connector_access",
            "switch_to_environment_debugging",
            "request_missing_input",
            "decompose_task_first",
            "switch_to_repro_minimization",
            "switch_to_schema_or_format_validation",
            "switch_to_alternative_tool_path"
          ],
          "description": "Standard route id from rules/routes.yaml. Must NOT be a free-text tool brand name."
        },
        "best_candidate_route_detail": {
          "type": "string",
          "maxLength": 400,
          "description": "Optional explanation of why this route is recommended."
        },
        "prerequisites_for_switch": {
          "type": "array",
          "items": {
            "type": "string",
            "maxLength": 60
          },
          "maxItems": 10,
          "description": "Lightweight checklist of what must be true before switching."
        },
        "confidence": {
          "type": "string",
          "enum": [
            "high",
            "medium",
            "low"
          ],
          "description": "Confidence in this inference."
        }
      },
      "additionalProperties": false
    },
    "resolution": {
      "type": "object",
      "description": "What happened after the recommendation was applied.",
      "properties": {
        "outcome": {
          "type": "string",
          "enum": [
            "resolved",
            "partially_resolved",
            "unresolved",
            "unknown"
          ]
        },
        "follow_up_notes": {
          "type": "string",
          "maxLength": 300
        }
      },
      "additionalProperties": false
    },
    "related_cases": {
      "type": "array",
      "items": {
        "type": "string"
      },
      "maxItems": 20
    },
    "legacy_mapping": {
      "type": "object",
      "description": "Preserves mapping from v1/v2.0 fields for backward compatibility.",
      "properties": {
        "legacy_schema_version": {
          "type": "string"
        },
        "legacy_failure_type": {
          "type": "string"
        },
        "legacy_skill_triggered": {
          "type": "string"
        },
        "legacy_task_category": {
          "type": "string"
        },
        "legacy_journey_stage": {
          "type": "string"
        }
      },
      "additionalProperties": false
    }
  },
  "additionalProperties": false
}
